{
  "schemaVersion": 3,
  "runId": "afb90da4-28f2-4f98-955f-bb420836ad35",
  "benchmarkVersion": "v1.0.0rc1-34-g35858bf",
  "startedAt": "2026-09-20T16:16:47.771735Z",
  "measurementStartedAt": "2026-09-20T16:18:47.873212Z",
  "endedAt": "2026-09-20T16:28:47.87918Z",
  "duration": "10m0s",
  "warmup": "2m0s",
  "profile": {
    "schemaVersion": 1,
    "name": "small",
    "warmup": "2m0s",
    "duration": "10m0s",
    "seed": 650,
    "fixture": "benchmarks/fixtures/small/fixture.json",
    "operationTimeout": "5s",
    "clients": {
      "users": 5,
      "websockets": 5,
      "activeLocomotives": 3,
      "workers": 16
    },
    "rates": {
      "loginPerSecond": 0.1,
      "refreshPerSecond": 0.1,
      "leaseAcquirePerSecond": 0.2,
      "leaseHeartbeatPerSecond": 1,
      "leaseReleasePerSecond": 0.2,
      "throttlePerSecond": 3,
      "functionsPerSecond": 1,
      "feedbackPerSecond": 5,
      "accessoriesPerSecond": 1,
      "routeOperationsPerSecond": 0.5,
      "readsPerSecond": 3
    },
    "behavior": {
      "reconnectProbability": 0.001,
      "snapshotProbability": 0.001,
      "dropEventProbability": 0
    },
    "expectedErrors": [
      {
        "operation": "lease_acquire",
        "httpStatuses": [
          409
        ]
      },
      {
        "operation": "route",
        "httpStatuses": [
          409
        ]
      }
    ]
  },
  "profileSha256": "554a367e2c9c343f23fb93f2cedd610a77bba2a58a522b50f1c4b6c246069c08",
  "fixtureSha256": "0e912847dcea39ecf0f006ec5f607e36a03094dbe1a9a9b4fcf18e49908098ed",
  "seed": 650,
  "server": {
    "url": "http://192.168.0.60:8080",
    "serverVersion": "0.2.0",
    "apiVersion": "1.7.0",
    "eventApiVersion": "1.9.1",
    "stationDriver": "simulator"
  },
  "clientHost": {
    "hostname": "mbair-m5.local",
    "os": "darwin",
    "arch": "arm64",
    "cpus": 10,
    "goVersion": "go1.27.1"
  },
  "operations": {
    "accessory": {
      "requestedRatePerSecond": 1,
      "count": 600,
      "successes": 600,
      "expectedErrors": 0,
      "unexpectedErrors": 0,
      "timeouts": 0,
      "skipped": 0,
      "achievedRatePerSecond": 0.9999900534322684,
      "latency": {
        "p50Milliseconds": 10.576917,
        "p90Milliseconds": 18.850792,
        "p95Milliseconds": 22.990708,
        "p99Milliseconds": 30.658542,
        "maxMilliseconds": 50.30325
      }
    },
    "feedback": {
      "requestedRatePerSecond": 5,
      "count": 2983,
      "successes": 2983,
      "expectedErrors": 0,
      "unexpectedErrors": 0,
      "timeouts": 0,
      "skipped": 0,
      "achievedRatePerSecond": 4.971617215647428,
      "latency": {
        "p50Milliseconds": 4.989375,
        "p90Milliseconds": 11.389917,
        "p95Milliseconds": 15.097125,
        "p99Milliseconds": 29.9945,
        "maxMilliseconds": 130.818292
      }
    },
    "function": {
      "requestedRatePerSecond": 1,
      "count": 599,
      "successes": 599,
      "expectedErrors": 0,
      "unexpectedErrors": 0,
      "timeouts": 0,
      "skipped": 0,
      "achievedRatePerSecond": 0.9983234033432147,
      "latency": {
        "p50Milliseconds": 7.0085,
        "p90Milliseconds": 13.331917,
        "p95Milliseconds": 19.260208,
        "p99Milliseconds": 32.64725,
        "maxMilliseconds": 64.528042
      }
    },
    "health": {
      "requestedRatePerSecond": 1,
      "count": 599,
      "successes": 599,
      "expectedErrors": 0,
      "unexpectedErrors": 0,
      "timeouts": 0,
      "skipped": 0,
      "achievedRatePerSecond": 0.9983234033432147,
      "latency": {
        "p50Milliseconds": 2.830333,
        "p90Milliseconds": 7.171542,
        "p95Milliseconds": 11.647875,
        "p99Milliseconds": 31.30325,
        "maxMilliseconds": 215.014042
      }
    },
    "lease_acquire": {
      "requestedRatePerSecond": 0.2,
      "count": 120,
      "successes": 120,
      "expectedErrors": 0,
      "unexpectedErrors": 0,
      "timeouts": 0,
      "skipped": 0,
      "achievedRatePerSecond": 0.19999801068645368,
      "latency": {
        "p50Milliseconds": 7.255167,
        "p90Milliseconds": 13.321541,
        "p95Milliseconds": 15.442209,
        "p99Milliseconds": 17.37,
        "maxMilliseconds": 18.305334
      }
    },
    "lease_heartbeat": {
      "requestedRatePerSecond": 1,
      "count": 600,
      "successes": 600,
      "expectedErrors": 0,
      "unexpectedErrors": 0,
      "timeouts": 0,
      "skipped": 0,
      "achievedRatePerSecond": 0.9999900534322684,
      "latency": {
        "p50Milliseconds": 6.625917,
        "p90Milliseconds": 13.166375,
        "p95Milliseconds": 16.027292,
        "p99Milliseconds": 31.073917,
        "maxMilliseconds": 102.604417
      }
    },
    "lease_release": {
      "requestedRatePerSecond": 0.2,
      "count": 120,
      "successes": 120,
      "expectedErrors": 0,
      "unexpectedErrors": 0,
      "timeouts": 0,
      "skipped": 0,
      "achievedRatePerSecond": 0.19999801068645368,
      "latency": {
        "p50Milliseconds": 7.264792,
        "p90Milliseconds": 13.640917,
        "p95Milliseconds": 17.44025,
        "p99Milliseconds": 27.430333,
        "maxMilliseconds": 36.914875
      }
    },
    "login": {
      "requestedRatePerSecond": 0.1,
      "count": 61,
      "successes": 61,
      "expectedErrors": 0,
      "unexpectedErrors": 0,
      "timeouts": 0,
      "skipped": 0,
      "achievedRatePerSecond": 0.10166565543228062,
      "latency": {
        "p50Milliseconds": 3091.306041,
        "p90Milliseconds": 3137.062708,
        "p95Milliseconds": 3161.75,
        "p99Milliseconds": 3792.001083,
        "maxMilliseconds": 3792.001083
      }
    },
    "read": {
      "requestedRatePerSecond": 3,
      "count": 1794,
      "successes": 1794,
      "expectedErrors": 0,
      "unexpectedErrors": 0,
      "timeouts": 0,
      "skipped": 0,
      "achievedRatePerSecond": 2.9899702597624827,
      "latency": {
        "p50Milliseconds": 8.544,
        "p90Milliseconds": 18.332084,
        "p95Milliseconds": 22.433583,
        "p99Milliseconds": 34.962667,
        "maxMilliseconds": 177.622
      }
    },
    "refresh": {
      "requestedRatePerSecond": 0.1,
      "count": 60,
      "successes": 60,
      "expectedErrors": 0,
      "unexpectedErrors": 0,
      "timeouts": 0,
      "skipped": 0,
      "achievedRatePerSecond": 0.09999900534322684,
      "latency": {
        "p50Milliseconds": 7.303542,
        "p90Milliseconds": 14.129667,
        "p95Milliseconds": 21.078209,
        "p99Milliseconds": 28.892959,
        "maxMilliseconds": 28.892959
      }
    },
    "route": {
      "requestedRatePerSecond": 0.5,
      "count": 300,
      "successes": 130,
      "expectedErrors": 170,
      "unexpectedErrors": 0,
      "timeouts": 0,
      "skipped": 0,
      "achievedRatePerSecond": 0.4999950267161342,
      "latency": {
        "p50Milliseconds": 6.330083,
        "p90Milliseconds": 14.449959,
        "p95Milliseconds": 17.347791,
        "p99Milliseconds": 24.435041,
        "maxMilliseconds": 38.87775
      }
    },
    "throttle": {
      "requestedRatePerSecond": 3,
      "count": 1794,
      "successes": 1794,
      "expectedErrors": 0,
      "unexpectedErrors": 0,
      "timeouts": 0,
      "skipped": 0,
      "achievedRatePerSecond": 2.9899702597624827,
      "latency": {
        "p50Milliseconds": 9.329583,
        "p90Milliseconds": 17.653208,
        "p95Milliseconds": 21.870875,
        "p99Milliseconds": 36.063084,
        "maxMilliseconds": 116.3985
      }
    },
    "websocket_connect": {
      "count": 26,
      "successes": 26,
      "expectedErrors": 0,
      "unexpectedErrors": 0,
      "timeouts": 0,
      "skipped": 0,
      "achievedRatePerSecond": 0.0433329023153983,
      "latency": {
        "p50Milliseconds": 10.049875,
        "p90Milliseconds": 26.058208,
        "p95Milliseconds": 28.961959,
        "p99Milliseconds": 42.368291,
        "maxMilliseconds": 42.368291
      }
    }
  },
  "webSocket": {
    "connections": 40,
    "disconnections": 40,
    "reconnects": 35,
    "sequenceGaps": 0,
    "snapshots": 73,
    "snapshotRequests": 33,
    "eventsReceived": 44873,
    "invalidMessages": 0,
    "unresolvedSequenceGaps": 0,
    "feedbackLatency": {
      "p50Milliseconds": 7.182458,
      "p90Milliseconds": 13.643542,
      "p95Milliseconds": 17.927584,
      "p99Milliseconds": 31.997459,
      "maxMilliseconds": 130.765416
    }
  },
  "availability": {
    "expectedOutages": 0,
    "unexpectedOutages": 0,
    "recoveries": 0,
    "totalUnavailableMilliseconds": 0,
    "maxUnavailableMilliseconds": 0,
    "unrecoveredOutages": 0
  },
  "invariants": [
    {
      "name": "action_state_consistency",
      "status": "PASS",
      "observations": 7172,
      "violationCount": 0
    },
    {
      "name": "exclusive_locomotive_lease",
      "status": "PASS",
      "observations": 145,
      "violationCount": 0
    },
    {
      "name": "incompatible_route_rejected",
      "status": "PASS",
      "observations": 49,
      "violationCount": 0
    },
    {
      "name": "no_implicit_restart",
      "status": "NOT_OBSERVED",
      "observations": 0,
      "violationCount": 0
    },
    {
      "name": "server_availability",
      "status": "PASS",
      "observations": 720,
      "violationCount": 0
    },
    {
      "name": "valid_json",
      "status": "PASS",
      "observations": 44947,
      "violationCount": 0
    },
    {
      "name": "valid_lease_required",
      "status": "PASS",
      "observations": 1,
      "violationCount": 0
    },
    {
      "name": "websocket_resynchronization",
      "status": "NOT_OBSERVED",
      "observations": 0,
      "violationCount": 0
    }
  ],
  "overallResult": "PASS"
}
